{"schema_version":1,"id":"lumen-explorer-data-v1","title":"Lumen explorer aggregate fixture","kind":"git_fixture","schema":"lumen-explorer-aggregate-v1","format":"json","content":{"bytes":432353,"sha256":"5337d4bdc574726a2cb4e28f329f16709b497479a7493882bd38d77875660ac9"},"locations":{"local_path":"tests/fixtures/lumen_explorer_data.json","canonical":"https://github.com/bc1cindy/decluster/raw/103b13efc9e32569642983d7038f365dcb0c09c6/tests/fixtures/lumen_explorer_data.json","mirrors":[]},"source":{"provider":"Lumen explorer public aggregate","snapshot_time":"2026-08-31T02:40:25Z","recipe":null,"recipe_sha256":null},"license":{"data":"upstream license undetermined; redistribution authorized by the dataset publisher on 2026-09-04","recipe":null},"redistribution":"allowed","sensitivity":"public_auxiliary","normalization":{"code_revision":"103b13efc9e32569642983d7038f365dcb0c09c6","parameters":{},"parents":[]},"determinism":{"ordering":"canonical byte order as stored","rng_algorithm":null,"rng_seed":null}}
