{"schema_version":1,"id":"graph-deanon-2016-v1","title":"Bitcoin graph-structure fixture from 2016","kind":"git_fixture","schema":"bitcoin-address-graph-ndjson-v1","format":"ndjson.gz","content":{"bytes":1405865,"sha256":"68690ce8689378321e4187b111c7b4300f88e5bb405a25dcb67125cd0c739c5b"},"locations":{"local_path":"tests/fixtures/graph_deanon_2016.ndjson.gz","canonical":"https://github.com/bc1cindy/decluster/raw/2fdbd9573c12540012ffef83fb25114120d27ef6/tests/fixtures/graph_deanon_2016.ndjson.gz","mirrors":[]},"source":{"provider":"decluster graph fixture export","snapshot_time":"2026-08-31T02:48:43Z","recipe":null,"recipe_sha256":null},"license":{"data":"upstream license undetermined; redistribution authorized by the dataset publisher on 2026-09-04","recipe":null},"redistribution":"allowed","sensitivity":"public_on_chain","normalization":{"code_revision":"2fdbd9573c12540012ffef83fb25114120d27ef6","parameters":{},"parents":[]},"determinism":{"ordering":"canonical byte order as stored","rng_algorithm":null,"rng_seed":null}}
