{
  "schema_version": 1,
  "id": "epoch-graph-2016-391104-392111-v1",
  "title": "2016 weekly address graph, blocks 391104-392111",
  "kind": "immutable_snapshot",
  "schema": "decluster-epoch-graph-v1",
  "format": "epochgraph.xz",
  "content": {
    "bytes": 10422968,
    "sha256": "cd129cd4bb225ea7a6733dab891b20272d62d1b0f3a6caf07a4209f9f2368015"
  },
  "locations": {
    "local_path": "data/epochs-2016-weekly-v1/391104-392111.epochgraph.xz",
    "canonical": null,
    "mirrors": []
  },
  "source": {
    "provider": "derived from a project-held BigQuery export of the public chain",
    "snapshot_time": "2026-08",
    "recipe": "decluster/epoch_graph.py",
    "recipe_sha256": "8d9f0b23b80b1ce8548c57001cb590a7a1b816f5046ef07b74febcd94930eee2"
  },
  "license": {
    "data": "public on-chain data; redistribution authorized by the exporter",
    "recipe": "MIT"
  },
  "redistribution": "allowed",
  "sensitivity": "public_on_chain",
  "normalization": {
    "code_revision": "5890be00cedaa288bf72457cf84a5834ad97a573",
    "parameters": {
      "transactions": 982021,
      "dropped": "txid, which no consumer reads",
      "addresses": "replaced by integers in one namespace shared by every window, so an id means the same address in each; the engine's output is invariant under any bijective renaming (tests/test_epoch_graph.py)",
      "kept_verbatim": "addresses a name-emitting detector matches by prefix",
      "compression": "lzma preset 6",
      "namespace": "epochs-2016-weekly-v1"
    },
    "parents": []
  },
  "determinism": {
    "ordering": "export record order",
    "rng_algorithm": null,
    "rng_seed": null
  }
}
