{"schema_version":1,"id":"fingerprint-blkcache-sample-v1","title":"Transaction-construction fingerprint sample","kind":"git_fixture","schema":"bitcoin-transaction-array-v1","format":"json","content":{"bytes":1701974,"sha256":"406ce2d7d0a04f7c73281bce6b6a781012a8765e079693f010a0154e926c6a6c"},"locations":{"local_path":"tests/fixtures/fingerprint_blkcache_sample.json","canonical":"https://github.com/bc1cindy/decluster/raw/2f1bbae5ac4923ff7b799b25be0dd66b4ec3f692/tests/fixtures/fingerprint_blkcache_sample.json","mirrors":[]},"source":{"provider":"decluster blkcache sample export","snapshot_time":"2026-08-31T02:40:25Z","recipe":null,"recipe_sha256":null},"license":{"data":"upstream license undetermined; redistribution authorized by the dataset publisher on 2026-09-04","recipe":null},"redistribution":"allowed","sensitivity":"public_on_chain","normalization":{"code_revision":"2f1bbae5ac4923ff7b799b25be0dd66b4ec3f692","parameters":{},"parents":[]},"determinism":{"ordering":"canonical byte order as stored","rng_algorithm":null,"rng_seed":null}}
