{"schema_version":1,"id":"entity-bitmex-2019-v1","title":"BitMEX 2019 null-control fixture","kind":"git_fixture","schema":"bitcoin-address-graph-ndjson-v1","format":"ndjson.gz","content":{"bytes":2523417,"sha256":"699c87235bce17a43a8befe2c412dd7bea61ffe3dd772abe7addcbae5a4b8ea8"},"locations":{"local_path":"tests/fixtures/entity_bitmex_2019.ndjson.gz","canonical":"https://github.com/bc1cindy/decluster/raw/678ecb5fa4681679c378d8adef7bd1c4f2800f37/tests/fixtures/entity_bitmex_2019.ndjson.gz","mirrors":[]},"source":{"provider":"decluster fixture export","snapshot_time":"2026-08-31T03:42:16Z","recipe":null,"recipe_sha256":null},"license":{"data":"unknown","recipe":null},"redistribution":"unknown","sensitivity":"public_auxiliary","normalization":{"code_revision":"678ecb5fa4681679c378d8adef7bd1c4f2800f37","parameters":{},"parents":[]},"determinism":{"ordering":"canonical byte order as stored","rng_algorithm":null,"rng_seed":null}}
