{"schema_version":1,"id":"reid-signatures-v1","title":"Ancestry-signature fixture for sparse matching","kind":"git_fixture","schema":"ancestry-signatures-json-v1","format":"json.gz","content":{"bytes":2051632,"sha256":"dbc4214fb499a96327326c4ea31341a76878c1867bfa3ccc57df88d850cdaa6a"},"locations":{"local_path":"tests/fixtures/reid_sigs.json.gz","canonical":"https://github.com/bc1cindy/decluster/raw/495874b5063bd83fc24e32eec1ebeb933471f6b9/tests/fixtures/reid_sigs.json.gz","mirrors":[]},"source":{"provider":"decluster ancestry-signature export","snapshot_time":"2026-08-31T02:40:25Z","recipe":null,"recipe_sha256":null},"license":{"data":"unknown","recipe":null},"redistribution":"unknown","sensitivity":"public_on_chain","normalization":{"code_revision":"495874b5063bd83fc24e32eec1ebeb933471f6b9","parameters":{},"parents":[]},"determinism":{"ordering":"canonical byte order as stored","rng_algorithm":null,"rng_seed":null}}
