{"schema_version":1,"id":"slice-a-channels-2016-v1","title":"Bitcoin channel-comparison fixture from 2016","kind":"git_fixture","schema":"bitcoin-address-graph-ndjson-v1","format":"ndjson.gz","content":{"bytes":1837504,"sha256":"66104889f8b79f2938edb6666f16dfa19a74c68cd8016832b4f2a5e03b11865f"},"locations":{"local_path":"tests/fixtures/slice_a_channels_2016.ndjson.gz","canonical":"https://github.com/bc1cindy/decluster/raw/43d3faaab07f6703361c300fb6d01a916bb063f0/tests/fixtures/slice_a_channels_2016.ndjson.gz","mirrors":[]},"source":{"provider":"decluster channel fixture export","snapshot_time":"2026-09-03T13:17:00Z","recipe":null,"recipe_sha256":null},"license":{"data":"unknown","recipe":null},"redistribution":"unknown","sensitivity":"public_on_chain","normalization":{"code_revision":"43d3faaab07f6703361c300fb6d01a916bb063f0","parameters":{},"parents":[]},"determinism":{"ordering":"canonical byte order as stored","rng_algorithm":null,"rng_seed":null}}
