{"schema_version":1,"id":"entity-satoshidice-2013-v1","title":"SatoshiDice 2013 positive-control fixture","kind":"git_fixture","schema":"bitcoin-address-graph-ndjson-v1","format":"ndjson.gz","content":{"bytes":1315051,"sha256":"6cac465a5eca59633fbb3e6f99b83146b9b0e590adf95801a303ccd815699846"},"locations":{"local_path":"tests/fixtures/entity_satoshidice_2013.ndjson.gz","canonical":"https://github.com/bc1cindy/decluster/raw/554e72131df9b28aa2a90b09184a159a841d3077/tests/fixtures/entity_satoshidice_2013.ndjson.gz","mirrors":[]},"source":{"provider":"decluster fixture export","snapshot_time":"2026-08-31T02:54:00Z","recipe":null,"recipe_sha256":null},"license":{"data":"upstream license undetermined; redistribution authorized by the dataset publisher on 2026-09-04","recipe":null},"redistribution":"allowed","sensitivity":"public_auxiliary","normalization":{"code_revision":"554e72131df9b28aa2a90b09184a159a841d3077","parameters":{},"parents":[]},"determinism":{"ordering":"canonical byte order as stored","rng_algorithm":null,"rng_seed":null}}
